<?xml version="1.0" encoding="UTF-8"?>
<Liste xmlns:xsi="http://www.w3.org/2001/XMLSchema-instance" xsi:noNamespaceSchemaLocation="Desideri.xsd"><Lista><Utente>abari@gmail.com</Utente><Prodotto>678</Prodotto><Prodotto>679</Prodotto></Lista><Lista><Utente>navid@gmail.com</Utente><Prodotto>680</Prodotto><Prodotto>681</Prodotto></Lista></Liste>
